{
  "format": "fmaze-browser-v0",
  "id": "simple_cantor_maze",
  "title": "Simple Cantor Maze",
  "primary_authoring": "port_graph",
  "source_root": "packages/source/simple_cantor_maze",
  "logic": {
    "format": "fmaze-logic-v0",
    "id": "simple_cantor_maze",
    "strategy": "pda_stack",
    "source_model": "port_graph",
    "start": "p1",
    "goals": [
      "p3"
    ],
    "points": [
      {
        "id": "p1",
        "label": "1",
        "description": "Outer top start gate from the SVG."
      },
      {
        "id": "p2",
        "label": "2",
        "description": "Midpoint between the A exit and B entry."
      },
      {
        "id": "p3",
        "label": "3",
        "description": "Outer bottom finish gate from the SVG."
      }
    ],
    "submazes": [
      {
        "id": "mA",
        "label": "A"
      },
      {
        "id": "mB",
        "label": "B"
      }
    ],
    "ports": [
      {
        "id": "p1_to_mA_p1",
        "point": "p1",
        "label": "A1",
        "kind": "enter_terminal"
      },
      {
        "id": "mA_p3_to_p2",
        "point": "p3",
        "context": [
          "mA"
        ],
        "label": "2",
        "kind": "exit_terminal"
      },
      {
        "id": "p2_to_mB_p1",
        "point": "p2",
        "label": "B1",
        "kind": "enter_terminal"
      },
      {
        "id": "mB_p3_to_p3",
        "point": "p3",
        "context": [
          "mB"
        ],
        "label": "3",
        "kind": "exit_terminal"
      }
    ],
    "transition_groups": [
      {
        "id": "g_p1_to_mA_p1",
        "direction": "one_way",
        "forward": {
          "id": "t_p1_to_mA_p1",
          "from_port": "p1_to_mA_p1",
          "source": "p1",
          "target": "mA.p1",
          "input": "A1"
        }
      },
      {
        "id": "g_mA_p3_to_p2",
        "direction": "one_way",
        "forward": {
          "id": "t_mA_p3_to_p2",
          "from_port": "mA_p3_to_p2",
          "source": "mA.p3",
          "target": "p2",
          "input": "2"
        }
      },
      {
        "id": "g_p2_to_mB_p1",
        "direction": "one_way",
        "forward": {
          "id": "t_p2_to_mB_p1",
          "from_port": "p2_to_mB_p1",
          "source": "p2",
          "target": "mB.p1",
          "input": "B1"
        }
      },
      {
        "id": "g_mB_p3_to_p3",
        "direction": "one_way",
        "forward": {
          "id": "t_mB_p3_to_p3",
          "from_port": "mB_p3_to_p3",
          "source": "mB.p3",
          "target": "p3",
          "input": "3"
        }
      }
    ],
    "proof_edges": [
      {
        "id": "pe_cantor_p1_to_p3",
        "proof_type": "cantor_hop",
        "status": "proved",
        "source": "p1",
        "target": "p3",
        "input": "proof:p1_to_p3",
        "enabled_by_default": false,
        "explanation": "The SVG's simple Cantor maze reaches the finish by descending into A, using the recursively repeated 1-to-3 crossing, crossing physically into B, and using the same crossing again.",
        "proof": {
          "method": "simplified_cantor_hop",
          "summary": "Assume every non-empty submaze context has the same p1-to-p3 crossing as the whole maze; the visible red support transitions connect the two recursive uses.",
          "presuppositions": [
            {
              "kind": "same_connection_for_all_non_empty_T",
              "source_template": "T.p1",
              "target_template": "T.p3"
            }
          ],
          "steps": [
            {
              "kind": "physical",
              "source": "p1",
              "target": "mA.p1",
              "reason": "The top red segment enters submaze A at terminal 1."
            },
            {
              "kind": "assumption",
              "source": "mA.p1",
              "target": "mA.p3",
              "reason": "Apply the Cantor presupposition inside A."
            },
            {
              "kind": "physical",
              "source": "mA.p3",
              "target": "p2",
              "reason": "The red middle connector exits A to point 2."
            },
            {
              "kind": "physical",
              "source": "p2",
              "target": "mB.p1",
              "reason": "The same red middle connector enters B from point 2."
            },
            {
              "kind": "assumption",
              "source": "mB.p1",
              "target": "mB.p3",
              "reason": "Apply the Cantor presupposition inside B."
            },
            {
              "kind": "physical",
              "source": "mB.p3",
              "target": "p3",
              "reason": "The lower red segment exits B to the finish at point 3."
            }
          ]
        }
      }
    ]
  },
  "solutions": [
    {
      "format": "fmaze-solution-v0",
      "id": "proof_assisted",
      "maze": "simple_cantor_maze",
      "logic": "../logic.yml",
      "expects_goal": true,
      "steps": [
        {
          "prove_edge_id": "pe_cantor_p1_to_p3"
        },
        {
          "proof_edge_id": "pe_cantor_p1_to_p3"
        }
      ]
    }
  ],
  "auto_graph_layout": {
    "algorithm": "level-bfs-v1",
    "spacing": {
      "x": 120.0,
      "y": 100.0
    },
    "bounds": {
      "width": 148.0,
      "height": 100.0
    },
    "points": {
      "p1": {
        "x": 0.0,
        "y": 0.0,
        "level": 0,
        "column": 0
      },
      "p2": {
        "x": -60.0,
        "y": 100.0,
        "level": 1,
        "column": 0
      },
      "p3": {
        "x": 60.0,
        "y": 100.0,
        "level": 1,
        "column": 1
      }
    },
    "ports": {
      "mA_p3_to_p2": {
        "x": 88.0,
        "y": 100.0,
        "level": 1,
        "column": 1
      },
      "mB_p3_to_p3": {
        "x": 32.0,
        "y": 100.0,
        "level": 1,
        "column": 1
      },
      "p1_to_mA_p1": {
        "x": 28.0,
        "y": 0.0,
        "level": 0,
        "column": 0
      },
      "p2_to_mB_p1": {
        "x": -32.0,
        "y": 100.0,
        "level": 1,
        "column": 0
      }
    }
  },
  "provenance": {
    "sources": [
      {
        "type": "image",
        "href": "../../../Maze_Images/Siggy/Simple_Cantor_Maze.svg"
      },
      {
        "type": "post",
        "href": "https://freethoughtblogs.com/atrivialknot/2023/10/21/infinite-fractal-mazes/"
      },
      {
        "type": "handwritten_record",
        "note": "Hand-authored from the visible \"simple cantor maze\" SVG layer."
      }
    ],
    "notes": [
      "The SVG has one outer frame, submazes A and B, numbered points 1, 2, and 3, and red physical connectors from 1 into A, A/B through 2, and B out to 3.",
      "The proof edge models the Cantor-style logical crossing from 1 to 3 by assuming the same 1-to-3 crossing inside each non-empty submaze context."
    ]
  }
}
