{
  "format": "fmaze-browser-v0",
  "id": "inner_frame",
  "title": "The Inner Frame",
  "primary_authoring": "port_graph",
  "source_root": "packages/source/inner_frame",
  "logic": {
    "format": "fmaze-logic-v0",
    "id": "inner_frame",
    "strategy": "pda_stack",
    "source_model": "port_graph",
    "start": "p1",
    "goals": [
      "p2"
    ],
    "points": [
      {
        "id": "p1",
        "label": "1"
      },
      {
        "id": "p2",
        "label": "2"
      },
      {
        "id": "p3",
        "label": "3"
      },
      {
        "id": "p4",
        "label": "4"
      },
      {
        "id": "p5",
        "label": "5"
      }
    ],
    "submazes": [
      {
        "id": "A"
      }
    ],
    "ports": [
      {
        "id": "port_inner_frame_c1_pop",
        "point": "p1",
        "context": [
          "A"
        ],
        "label": "2"
      },
      {
        "id": "port_inner_frame_c1_push",
        "point": "p2",
        "label": "1"
      },
      {
        "id": "port_inner_frame_c2_push",
        "point": "p1",
        "label": "3"
      },
      {
        "id": "port_inner_frame_c2_pop",
        "point": "p3",
        "context": [
          "A"
        ],
        "label": "1"
      },
      {
        "id": "port_inner_frame_c3_push",
        "point": "p1",
        "label": "4"
      },
      {
        "id": "port_inner_frame_c3_pop",
        "point": "p4",
        "context": [
          "A"
        ],
        "label": "1"
      },
      {
        "id": "port_inner_frame_c4_pop",
        "point": "p1",
        "context": [
          "A"
        ],
        "label": "5"
      },
      {
        "id": "port_inner_frame_c4_push",
        "point": "p5",
        "label": "1"
      },
      {
        "id": "port_inner_frame_c5_pop",
        "point": "p2",
        "context": [
          "A"
        ],
        "label": "3"
      },
      {
        "id": "port_inner_frame_c5_push",
        "point": "p3",
        "label": "2"
      },
      {
        "id": "port_inner_frame_c6_pop",
        "point": "p2",
        "context": [
          "A"
        ],
        "label": "4"
      },
      {
        "id": "port_inner_frame_c6_push",
        "point": "p4",
        "label": "2"
      },
      {
        "id": "port_inner_frame_c7_pop",
        "point": "p4",
        "context": [
          "A"
        ],
        "label": "5"
      },
      {
        "id": "port_inner_frame_c7_push",
        "point": "p5",
        "label": "4"
      },
      {
        "id": "port_inner_frame_c8_enter",
        "point": "p5",
        "label": "("
      },
      {
        "id": "port_inner_frame_c8_exit",
        "point": "p5",
        "context": [
          "A"
        ],
        "label": ")"
      }
    ],
    "transitions": [
      {
        "id": "inner_frame_c1_pop",
        "from_port": "port_inner_frame_c1_pop",
        "source": "A.p1",
        "target": "p2",
        "input": "2"
      },
      {
        "id": "inner_frame_c1_push",
        "from_port": "port_inner_frame_c1_push",
        "source": "p2",
        "target": "A.p1",
        "input": "1"
      },
      {
        "id": "inner_frame_c2_push",
        "from_port": "port_inner_frame_c2_push",
        "source": "p1",
        "target": "A.p3",
        "input": "3"
      },
      {
        "id": "inner_frame_c2_pop",
        "from_port": "port_inner_frame_c2_pop",
        "source": "A.p3",
        "target": "p1",
        "input": "1"
      },
      {
        "id": "inner_frame_c3_push",
        "from_port": "port_inner_frame_c3_push",
        "source": "p1",
        "target": "A.p4",
        "input": "4"
      },
      {
        "id": "inner_frame_c3_pop",
        "from_port": "port_inner_frame_c3_pop",
        "source": "A.p4",
        "target": "p1",
        "input": "1"
      },
      {
        "id": "inner_frame_c4_pop",
        "from_port": "port_inner_frame_c4_pop",
        "source": "A.p1",
        "target": "p5",
        "input": "5"
      },
      {
        "id": "inner_frame_c4_push",
        "from_port": "port_inner_frame_c4_push",
        "source": "p5",
        "target": "A.p1",
        "input": "1"
      },
      {
        "id": "inner_frame_c5_pop",
        "from_port": "port_inner_frame_c5_pop",
        "source": "A.p2",
        "target": "p3",
        "input": "3"
      },
      {
        "id": "inner_frame_c5_push",
        "from_port": "port_inner_frame_c5_push",
        "source": "p3",
        "target": "A.p2",
        "input": "2"
      },
      {
        "id": "inner_frame_c6_pop",
        "from_port": "port_inner_frame_c6_pop",
        "source": "A.p2",
        "target": "p4",
        "input": "4"
      },
      {
        "id": "inner_frame_c6_push",
        "from_port": "port_inner_frame_c6_push",
        "source": "p4",
        "target": "A.p2",
        "input": "2"
      },
      {
        "id": "inner_frame_c7_pop",
        "from_port": "port_inner_frame_c7_pop",
        "source": "A.p4",
        "target": "p5",
        "input": "5"
      },
      {
        "id": "inner_frame_c7_push",
        "from_port": "port_inner_frame_c7_push",
        "source": "p5",
        "target": "A.p4",
        "input": "4"
      },
      {
        "id": "inner_frame_c8_enter",
        "from_port": "port_inner_frame_c8_enter",
        "source": "p5",
        "target": "A.p5",
        "input": "("
      },
      {
        "id": "inner_frame_c8_exit",
        "from_port": "port_inner_frame_c8_exit",
        "source": "A.p5",
        "target": "p5",
        "input": ")"
      }
    ]
  },
  "solutions": [
    {
      "format": "fmaze-solution-v0",
      "id": "known",
      "maze": "inner_frame",
      "logic": "../logic.yml",
      "expects_goal": true,
      "steps": [
        {
          "transition_id": "inner_frame_c3_push"
        },
        {
          "transition_id": "inner_frame_c6_push"
        },
        {
          "transition_id": "inner_frame_c1_push"
        },
        {
          "transition_id": "inner_frame_c4_pop"
        },
        {
          "transition_id": "inner_frame_c8_exit"
        },
        {
          "transition_id": "inner_frame_c7_push"
        },
        {
          "transition_id": "inner_frame_c3_pop"
        },
        {
          "transition_id": "inner_frame_c1_pop"
        }
      ]
    }
  ],
  "auto_graph_layout": {
    "algorithm": "level-bfs-v1",
    "spacing": {
      "x": 120.0,
      "y": 100.0
    },
    "bounds": {
      "width": 402.0,
      "height": 156.0
    },
    "points": {
      "p1": {
        "x": 0.0,
        "y": 0.0,
        "level": 0,
        "column": 0
      },
      "p2": {
        "x": -180.0,
        "y": 100.0,
        "level": 1,
        "column": 0
      },
      "p3": {
        "x": -60.0,
        "y": 100.0,
        "level": 1,
        "column": 1
      },
      "p4": {
        "x": 60.0,
        "y": 100.0,
        "level": 1,
        "column": 2
      },
      "p5": {
        "x": 180.0,
        "y": 100.0,
        "level": 1,
        "column": 3
      }
    },
    "ports": {
      "port_inner_frame_c1_pop": {
        "x": 28.0,
        "y": 0.0,
        "level": 0,
        "column": 0
      },
      "port_inner_frame_c1_push": {
        "x": -152.0,
        "y": 100.0,
        "level": 1,
        "column": 0
      },
      "port_inner_frame_c2_pop": {
        "x": -32.0,
        "y": 100.0,
        "level": 1,
        "column": 1
      },
      "port_inner_frame_c2_push": {
        "x": 0.0,
        "y": 28.0,
        "level": 0,
        "column": 0
      },
      "port_inner_frame_c3_pop": {
        "x": 88.0,
        "y": 100.0,
        "level": 1,
        "column": 2
      },
      "port_inner_frame_c3_push": {
        "x": -28.0,
        "y": 0.0,
        "level": 0,
        "column": 0
      },
      "port_inner_frame_c4_pop": {
        "x": 0.0,
        "y": -28.0,
        "level": 0,
        "column": 0
      },
      "port_inner_frame_c4_push": {
        "x": 208.0,
        "y": 100.0,
        "level": 1,
        "column": 3
      },
      "port_inner_frame_c5_pop": {
        "x": -194.0,
        "y": 124.2487,
        "level": 1,
        "column": 0
      },
      "port_inner_frame_c5_push": {
        "x": -88.0,
        "y": 100.0,
        "level": 1,
        "column": 1
      },
      "port_inner_frame_c6_pop": {
        "x": -194.0,
        "y": 75.7513,
        "level": 1,
        "column": 0
      },
      "port_inner_frame_c6_push": {
        "x": 46.0,
        "y": 124.2487,
        "level": 1,
        "column": 2
      },
      "port_inner_frame_c7_pop": {
        "x": 46.0,
        "y": 75.7513,
        "level": 1,
        "column": 2
      },
      "port_inner_frame_c7_push": {
        "x": 180.0,
        "y": 128.0,
        "level": 1,
        "column": 3
      },
      "port_inner_frame_c8_enter": {
        "x": 152.0,
        "y": 100.0,
        "level": 1,
        "column": 3
      },
      "port_inner_frame_c8_exit": {
        "x": 180.0,
        "y": 72.0,
        "level": 1,
        "column": 3
      }
    }
  },
  "provenance": {
    "sources": [
      {
        "type": "package_logic",
        "href": "logic.yml"
      },
      {
        "type": "solution_record",
        "href": "solutions/known.yml"
      },
      {
        "type": "image",
        "href": "../../../Maze_Images/The_Inner_Frame.pdf"
      },
      {
        "type": "handwritten_logic",
        "note": "Hand-authored Port Graph package from the existing PDA transition table."
      }
    ]
  }
}
