{
  "format": "fmaze-browser-v0",
  "id": "koteitan_fractal_block_default",
  "title": "Koteitan Fractal Block Maze Default",
  "primary_authoring": "fractal_block_pattern",
  "source_root": "packages/source/koteitan_fractal_block_default",
  "logic": {
    "format": "fmaze-logic-v0",
    "id": "koteitan_fractal_block_default",
    "strategy": "coordinate_path",
    "source_model": "fractal_block_pattern",
    "start": {
      "kind": "boundary",
      "side": "south"
    },
    "goals": [
      {
        "kind": "boundary",
        "side": "north"
      }
    ],
    "pattern": {
      "cell_convention": {
        "0": "white_open",
        "1": "black_recursive"
      },
      "rows": [
        [
          1,
          0,
          1,
          1
        ],
        [
          0,
          1,
          0,
          1
        ],
        [
          1,
          0,
          1,
          1
        ],
        [
          1,
          1,
          0,
          0
        ]
      ]
    },
    "entry": {
      "direction": "north",
      "description": "Enter from the lower edge and search upward."
    },
    "goal": {
      "direction": "north",
      "description": "Solved when movement exits over the upper edge."
    },
    "solver": {
      "default_depth_limit": 5,
      "algorithm": "bounded_coordinate_path_bfs"
    }
  },
  "provenance": {
    "source": {
      "kind": "github_repository",
      "url": "https://github.com/koteitan/fractalblockmaze"
    },
    "notes": [
      "Default 4x4 generating pattern from main.js.",
      "The solver follows the v1.11-style bounded coordinate-path search."
    ]
  }
}
